### ISSUE TITLE
[Bug] Unable to resolve domains with only AAAA records

### ISSUE THREAD

**Issue by f0re1gnKey** [ClusterM/wg-obfuscator#42]
Version: 1.5
OS: Debian 13

Program Log:
```
[hk01][I] Listening on port 127.0.0.1:507 for source
[hk01][E] Can't resolve hostname 'xxxxxxxx.com': No address associated with hostname
[hk01][I] Stopped.
```

Capture network cards when the program starts: 
```
01:18:35.576920 eth0  Out IP 10.10.2.5.43285 > 10.10.2.254.53: 39816+ A? xxxxxxxx.com. (38)
01:18:35.578647 eth0  In  IP 10.10.2.254.53 > 10.10.2.5.43285: 39816 0/0/0 (38)
01:18:35.579043 eth0  Out IP 10.10.2.5.52491 > 10.10.2.254.53: 30459+ A? xxxxxxxx.com.lan. (42)
01:18:35.579633 eth0  In  IP 10.10.2.254.53 > 10.10.2.5.52491: 30459 NXDomain 0/0/0 (42)
```
